<?xml version="1.0" encoding="UTF-8"?><!--		
     *****************************************************************
	                                                                  
      Licensed Materials - Property of IBM                            
                                                                      
      5724-S68
	                                                                  
      Copyright IBM Corp. 2001, 2012  All Rights Reserved.            
                                                                      
      US Government Users Restricted Rights - Use, duplication or     
      disclosure restricted by GSA ADP Schedule Contract with         
      IBM Corp.                                                       
                                                                      
     *****************************************************************
		--><comm:config xmlns:comm="http://www.ibm.com/connections/communities/communities-config/1.0" xmlns:xsi="http://www.w3.org/2001/XMLSchema-instance" id="communities" xsi:schemaLocation="http://www.ibm.com/connections/communities/communities-config/1.0 communities-config.xsd">
<!-- START COMMUNITY SECURITY CONFIG -->
<comm:security>
		<comm:requirePlainJson>false</comm:requirePlainJson>
		<comm:loginConfigs>
			<comm:loginConfig name="default">
				<comm:property name="login.config.name">WSLogin</comm:property>
				<comm:property name="login.create.cookie.disabled">false</comm:property>
			</comm:loginConfig>
		</comm:loginConfigs>
	</comm:security>
<!-- END COMMUNITY SECURITY CONFIG -->
<!-- START COMMUNITY PAGING CONFIG -->
<comm:pagingSupport>
		<!-- Default value for all page sizes -->
		<comm:defaultPageSize>10</comm:defaultPageSize>		
		<!-- Max number of names to display in members type-ahead -->
		<comm:pageSize name="memberNameTypeAhead">15</comm:pageSize>
		<!-- Max number of DB records to return from type-ahead query -->
		<comm:pageSize name="tagNameTypeAhead">10</comm:pageSize>
		<!-- Max number of ldap records returned for name search -->
		<comm:pageSize name="ldapNameSearch">50</comm:pageSize> 
		<!-- Max number of names to return from name type-ahead query -->
		<comm:pageSize name="dbNameTypeAhead">50</comm:pageSize>
		<!-- Max number of tags in all/my community views -->
		<comm:pageSize name="communityListTags">75</comm:pageSize>
	</comm:pagingSupport>
<!-- END COMMUNITY PAGING CONFIG -->
<comm:activeContentFilter enabled="true"/>
<comm:descriptionSummary size="300"/>
<comm:showStartCommunityToUnauthenticated>true</comm:showStartCommunityToUnauthenticated>
<!-- START COMMUNITY TYPE CONFIG -->
<comm:communityTypes>
		<comm:communityType>
			<comm:name>public</comm:name>
			<comm:description>PUBLIC community type.</comm:description>
		</comm:communityType>
		<comm:communityType>
			<comm:name>private</comm:name>
			<comm:description>PRIVATE community type.</comm:description>
		</comm:communityType>
		<comm:communityType>
			<comm:name>publicInviteOnly</comm:name>
			<comm:description>PUBLIC INVITE ONLY community type.</comm:description>
		</comm:communityType>
	</comm:communityTypes>
<!-- END COMMUNITY TYPE CONFIG -->
<!-- START THEMES CONFIG -->
<comm:themes>
        <!-- Note: To turn off Themes, comment out all the comm:theme elements (but leave comm:themes) -->
        <comm:theme>
            <comm:themeUuid>default</comm:themeUuid>
            <comm:displayNameKey>label.theme.name.default</comm:displayNameKey>
            <comm:isScriptKey>false</comm:isScriptKey>            
            <comm:cssUrl>/nav/common/styles/defaultTheme/defaultTheme.css</comm:cssUrl>
            <comm:cssRtlUrl>/nav/common/styles/defaultTheme/defaultThemeRTL.css</comm:cssRtlUrl>
            <comm:thumbnailUrl>/images/default.png</comm:thumbnailUrl>                               
        </comm:theme> 
        <comm:theme>
            <comm:themeUuid>red</comm:themeUuid>
            <comm:displayNameKey>label.theme.name.red</comm:displayNameKey>
            <comm:isScriptKey>false</comm:isScriptKey>            
            <comm:cssUrl>/nav/common/styles/redTheme/redTheme.css</comm:cssUrl>
            <comm:cssRtlUrl>/nav/common/styles/redTheme/redThemeRTL.css</comm:cssRtlUrl>
            <comm:thumbnailUrl>/images/red.png</comm:thumbnailUrl>                               
        </comm:theme>                 
        <comm:theme>
            <comm:themeUuid>green</comm:themeUuid>
            <comm:displayNameKey>label.theme.name.green</comm:displayNameKey>
            <comm:isScriptKey>false</comm:isScriptKey>                       
            <comm:cssUrl>/nav/common/styles/greenTheme/greenTheme.css</comm:cssUrl>
            <comm:cssRtlUrl>/nav/common/styles/greenTheme/greenThemeRTL.css</comm:cssRtlUrl>
            <comm:thumbnailUrl>/images/green.png</comm:thumbnailUrl>                               
        </comm:theme>    
        <comm:theme>
            <comm:themeUuid>gold</comm:themeUuid>
            <comm:displayNameKey>label.theme.name.coffee</comm:displayNameKey>
            <comm:isScriptKey>false</comm:isScriptKey>                       
            <comm:cssUrl>/nav/common/styles/goldTheme/goldTheme.css</comm:cssUrl>
            <comm:cssRtlUrl>/nav/common/styles/goldTheme/goldThemeRTL.css</comm:cssRtlUrl>
            <comm:thumbnailUrl>/images/gold.png</comm:thumbnailUrl>                               
        </comm:theme>
        <comm:theme>
            <comm:themeUuid>silver</comm:themeUuid>
            <comm:displayNameKey>label.theme.name.silver</comm:displayNameKey>
            <comm:isScriptKey>false</comm:isScriptKey>                       
            <comm:cssUrl>/nav/common/styles/silverTheme/silverTheme.css</comm:cssUrl>
            <comm:cssRtlUrl>/nav/common/styles/silverTheme/silverThemeRTL.css</comm:cssRtlUrl>
            <comm:thumbnailUrl>/images/silver.png</comm:thumbnailUrl>                               
        </comm:theme>        
        <comm:theme>
            <comm:themeUuid>blue</comm:themeUuid>
            <comm:displayNameKey>label.theme.name.blue</comm:displayNameKey>
            <comm:isScriptKey>false</comm:isScriptKey>                       
            <comm:cssUrl>/nav/common/styles/blueTheme/blueTheme.css</comm:cssUrl>
            <comm:cssRtlUrl>/nav/common/styles/blueTheme/blueThemeRTL.css</comm:cssRtlUrl>
            <comm:thumbnailUrl>/images/blue.png</comm:thumbnailUrl>                               
        </comm:theme>
        <comm:theme>
            <comm:themeUuid>pink</comm:themeUuid>
            <comm:displayNameKey>label.theme.name.pink</comm:displayNameKey>
            <comm:isScriptKey>false</comm:isScriptKey>                       
            <comm:cssUrl>/nav/common/styles/pinkTheme/pinkTheme.css</comm:cssUrl>
            <comm:cssRtlUrl>/nav/common/styles/pinkTheme/pinkThemeRTL.css</comm:cssRtlUrl>
            <comm:thumbnailUrl>/images/pink.png</comm:thumbnailUrl>                               
        </comm:theme>        
        <comm:theme>
            <comm:themeUuid>onyx</comm:themeUuid>
            <comm:displayNameKey>label.theme.name.onyx</comm:displayNameKey>
            <comm:isScriptKey>false</comm:isScriptKey>                       
            <comm:cssUrl>/nav/common/styles/onyxTheme/onyxTheme.css</comm:cssUrl>
            <comm:cssRtlUrl>/nav/common/styles/onyxTheme/onyxThemeRTL.css</comm:cssRtlUrl>
            <comm:thumbnailUrl>/images/onyx.png</comm:thumbnailUrl>                               
        </comm:theme>              
        <comm:theme>
            <comm:themeUuid>purple</comm:themeUuid>
            <comm:displayNameKey>label.theme.name.purple</comm:displayNameKey>
            <comm:isScriptKey>false</comm:isScriptKey>                       
            <comm:cssUrl>/nav/common/styles/purpleTheme/purpleTheme.css</comm:cssUrl>
            <comm:cssRtlUrl>/nav/common/styles/purpleTheme/purpleThemeRTL.css</comm:cssRtlUrl>
            <comm:thumbnailUrl>/images/purple.png</comm:thumbnailUrl>                               
        </comm:theme>        
        <comm:theme>
            <comm:themeUuid>orange</comm:themeUuid>
            <comm:displayNameKey>label.theme.name.orange</comm:displayNameKey>
            <comm:isScriptKey>false</comm:isScriptKey>                       
            <comm:cssUrl>/nav/common/styles/orangeTheme/orangeTheme.css</comm:cssUrl>
            <comm:cssRtlUrl>/nav/common/styles/orangeTheme/orangeThemeRTL.css</comm:cssRtlUrl>
            <comm:thumbnailUrl>/images/orange.png</comm:thumbnailUrl>                               
        </comm:theme> 

	<!-- Custom theme added by denise -->
	  <comm:theme>
            <comm:themeUuid>corporateTheme</comm:themeUuid>
            <comm:displayNameKey>corporateTheme</comm:displayNameKey>
            <comm:isScriptKey>false</comm:isScriptKey>            
            <comm:cssUrl>/nav/common/styles/corporateTheme/corporateTheme.css</comm:cssUrl>
            <comm:cssRtlUrl>/nav/common/styles/corporateTheme/corporateThemeRTL.css</comm:cssRtlUrl>
            <comm:thumbnailUrl>/images/corporateTheme.jpg</comm:thumbnailUrl>                               
        </comm:theme>                 
       
        <!-- Comment out down to here to turn off Themes -->
    </comm:themes>
<comm:scheduledTasks>

	<!--
	There can be any number of tasks >= 1, and each must have a complete list of attributes - 
	name=, interval=, startby= , enabled=, scope=, type=, targetName=, mbeanMethodName=, and 
	serverName=. It is expected that the user admin would change only interval= and enabled= 
	(and possibly startby=), but the others are described below for completeness.

	name= is the name of the task.  This name is used to report task events in
	SystemOut.log.  Do not change the name for type=internal tasks.
	
	interval= specifies the task schedule. interval= (and startby=) are "cron" schedules.